{
  "schema_version": "0.1",
  "kind": "workspace_context_policy_decision",
  "decision_id": "wcpd-valid-project-modify-001",
  "request": {
    "request_id": "workspace-context-request-001",
    "operation": "workspace.context.project",
    "risk_class": "moderate",
    "requested_by": "SocioProphet/agentplane",
    "sensitivity": "internal",
    "release_mode": "recipient-bound",
    "recall_mode": "none",
    "workroom_ref": "workroom://workroom-demo-0001",
    "context_graph_ref": "ctxgraph-demo-0001",
    "authority_binding_ref": "workspace-context-authority-binding-demo-0001"
  },
  "decision": {
    "result": "modify",
    "reason": "Recipient-bound projection is permitted only with audit and scope limits."
  },
  "rule_refs": [
    "policy-fabric:workspace-context-v0:recipient-bound-projection"
  ],
  "evidence_refs": [
    "agentplane://evidence/workroom-context-demo-0001",
    "platform://workspace-context-record-demo-0001"
  ],
  "runtime_constraints": [
    {
      "constraint_id": "scope-limit-workroom-v0",
      "constraint_type": "scope_limit",
      "description": "Projection is limited to refs associated with the requesting workroom."
    },
    {
      "constraint_id": "audit-required-v0",
      "constraint_type": "audit_required",
      "description": "Downstream runtime must emit an evidence receipt."
    }
  ],
  "audit_payload": {
    "decision_ref": "wcpd-valid-project-modify-001",
    "request_ref": "workspace-context-request-001",
    "result": "modify",
    "summary": "Recipient-bound projection requires scope and audit constraints."
  }
}
